<?xml version="1.0" encoding="UTF-8"?>
<beer-items xmlns:xsi="http://www.w3.org/2001/XMLSchema-instance"
	xsi:noNamespaceSchemaLocation="BeerItemsScheme.xsd">
	<beer beer-id="1">
		<name>Zhiguli amber</name>
		<sort-type>lager</sort-type>
		<manufacturer>Olivaria brewery</manufacturer>
		<ingredients>
			<water>89</water>
			<sugar>2</sugar>
			<hop>3</hop>
			<malt>3</malt>
			<yeast>3</yeast>
		</ingredients>
		<alcohol>alcoholic beverage</alcohol>
		<chars alcohol-volume="4.8">
			<beer-clarity>11</beer-clarity>
			<is-filtered>true</is-filtered>
			<food-value>42</food-value>
			<packaging-type>
				<package-capacity>0.5</package-capacity>
				<package-material>glass</package-material>
			</packaging-type>
		</chars>
	</beer>

	<beer beer-id="2">
		<name>Praha pilsner</name>
		<sort-type>light</sort-type>
		<manufacturer>Olivaria brewery</manufacturer>
		<ingredients>
			<water>89</water>
			<sugar>2</sugar>
			<hop>3</hop>
			<malt>3</malt>
			<yeast>3</yeast>
		</ingredients>
		<alcohol>alcoholic beverage</alcohol>
		<chars alcohol-volume="4.6">
			<beer-clarity>11</beer-clarity>
			<is-filtered>true</is-filtered>
			<food-value>42</food-value>
			<packaging-type>
				<package-capacity>0.5</package-capacity>
				<package-material>glass</package-material>
			</packaging-type>
		</chars>
	</beer>

	<beer beer-id="3">
		<name>The taste of Manchester</name>
		<sort-type>light</sort-type>
		<manufacturer>Olivaria brewery</manufacturer>
		<ingredients>
			<water>89</water>
			<sugar>2</sugar>
			<hop>3</hop>
			<malt>3</malt>
			<yeast>3</yeast>
		</ingredients>
		<alcohol>alcoholic beverage</alcohol>
		<chars alcohol-volume="4.4">
			<beer-clarity>11</beer-clarity>
			<is-filtered>true</is-filtered>
			<food-value>42</food-value>
			<packaging-type>
				<package-capacity>0.5</package-capacity>
				<package-material>glass</package-material>
			</packaging-type>
		</chars>
	</beer>

	<beer beer-id="4">
		<name>Baltika export</name>
		<sort-type>light</sort-type>
		<manufacturer>Olivaria brewery</manufacturer>
		<ingredients>
			<water>88</water>
			<sugar>3</sugar>
			<hop>3</hop>
			<malt>3</malt>
			<yeast>3</yeast>
		</ingredients>
		<alcohol>alcoholic beverage</alcohol>
		<chars alcohol-volume="4.6">
			<beer-clarity>12</beer-clarity>
			<is-filtered>true</is-filtered>
			<food-value>46</food-value>
			<packaging-type>
				<package-capacity>0.5</package-capacity>
				<package-material>steel</package-material>
			</packaging-type>
		</chars>
	</beer>

	<beer beer-id="5">
		<name>Holsten pilsener</name>
		<sort-type>ale</sort-type>
		<manufacturer>Olivaria brewery</manufacturer>
		<ingredients>
			<water>89</water>
			<sugar>2</sugar>
			<hop>3</hop>
			<malt>3</malt>
			<yeast>3</yeast>
		</ingredients>
		<alcohol>alcoholic beverage</alcohol>
		<chars alcohol-volume="4.5">
			<beer-clarity>11</beer-clarity>
			<is-filtered>true</is-filtered>
			<food-value>43</food-value>
			<packaging-type>
				<package-capacity>0.5</package-capacity>
				<package-material>steel</package-material>
			</packaging-type>
		</chars>
	</beer>

	<beer beer-id="6">
		<name>Alivaria white gold</name>
		<sort-type>black</sort-type>
		<manufacturer>Olivaria brewery</manufacturer>
		<ingredients>
			<water>88</water>
			<sugar>3</sugar>
			<hop>3</hop>
			<malt>3</malt>
			<yeast>3</yeast>
		</ingredients>
		<alcohol>alcoholic beverage</alcohol>
		<chars alcohol-volume="5.0">
			<beer-clarity>12</beer-clarity>
			<is-filtered>true</is-filtered>
			<food-value>46</food-value>
			<packaging-type>
				<package-capacity>0.5</package-capacity>
				<package-material>steel</package-material>
			</packaging-type>
		</chars>
	</beer>

	<beer beer-id="7">
		<name>Budweiser Budvar</name>
		<sort-type>lager</sort-type>
		<manufacturer>Anheuser Busch</manufacturer>
		<ingredients>
			<water>87</water>
			<sugar>2</sugar>
			<hop>1</hop>
			<malt>5</malt>
			<yeast>5</yeast>
		</ingredients>
		<alcohol>soft beverage</alcohol>
		<chars>
			<beer-clarity>15</beer-clarity>
			<is-filtered>true</is-filtered>
			<food-value>42</food-value>
			<packaging-type>
				<package-capacity>0.33</package-capacity>
				<package-material>glass</package-material>
			</packaging-type>
		</chars>
	</beer>

</beer-items>
